url,title,cluster,keywords_top
https://getmaxim.ai/articles/why-evals-matter-the-backbone-of-reliable-ai-in-2025/,Why Evals Matter: The Backbone of Reliable AI in 2025,4,evals; evaluation; ai; rubrics; agent; tool; tests; policy; metrics; graders; safety; checks; thresholds; program; deterministic checks; pass; production; golden; rubric; change; adherence; changes; llm; shadow; evaluation program; quality; drift; tasks; nist; nist ai
https://getmaxim.ai/articles/mastering-rag-evaluation-using-maxim-ai/,Mastering RAG Evaluation Using Maxim AI,4,rag; evidence; long context; position; long; fairness; evaluation; ranking; sensitivity; attribution; bias; evaluators; context; generation; retrieval; rubrics; maxim; llm; routing; query; biased; ai; lost; self; judgments; 2024; accuracy; grounded; factual; model
https://getmaxim.ai/articles/llm-as-a-judge-a-practical-reliable-path-to-evaluating-ai-systems-at-scale/,"LLM as a Judge: A Practical, Reliable Path to Evaluating AI Systems at Scale",4,judge; rubric; agreement; llm judge; rubrics; evaluation; ai; gold; llm; reference; model; safety; maxim; metrics; task; human; preference; agent; calibration; output; rate; style; use; checks; policy; bias; domain; correctness; compute; prompts
https://getmaxim.ai/articles/a-practitioners-guide-to-prompt-engineering-in-2025/,A Practitioner’s Guide to Prompt Engineering in 2025,0,prompt; prompt engineering; agent; string; tool; shot; experimentation; step; evaluation; json; structured; use; simulation; output; plan; observability; engineering; agent observability; faithfulness; simulation evaluation; schema; self consistency; thought; react; chain thought; online; prompts; structured outputs; thoughts; pattern
https://getmaxim.ai/articles/top-5-ai-evals-tools-for-enterprises-in-2025-features-strengths-and-use-cases/,"Top 5 AI Evals Tools for Enterprises in 2025: Features, Strengths, and Use Cases",2,evals; online evals; online; offline; offline evals; evaluation; tool; simulation; production; observability; use cases; evaluator; dataset; enterprises; groundedness; latency; use; cases; turn; cost; agent; faithfulness; traffic; simulations; overview; sampling; rbac; policy; policy adherence; production traffic
https://getmaxim.ai/articles/top-5-ai-agent-frameworks-in-2025-a-practical-guide-for-ai-builders/,"Best AI Agent Frameworks 2025: LangGraph, CrewAI, OpenAI, LlamaIndex, AutoGen",2,agent; crewai; llamaindex; autogen; openai agents; production; online; online evaluations; evaluations; evaluation; langgraph; agents; maxim; observability; framework; tool; multi; openai; multi agent; use; faithfulness; frameworks; choose; alerts; related reading; agent frameworks; agent collaboration; integrate maxim; node; human
https://getmaxim.ai/articles/building-ai-products-in-2025-a-practical-blueprint-for-speed-reliability-and-scale/,"Building AI Products in 2025: A Practical Blueprint For Speed, Reliability, and Scale",3,agent; evaluation; ai; observability; online; agent observability; maxim; session; review; alerts; experimentation; product; evaluators; offline; quality; overview; evaluator; simulation; node; loop; data; structured; start; human; use; sessions; layer; spans; queues; metrics
https://getmaxim.ai/articles/ai-observability-in-2025-how-to-monitor-evaluate-and-improve-ai-agents-in-production/,"AI Observability in 2025: Monitor, Evaluate, and Improve AI Agents",3,evaluations; online; online evaluations; observability; faithfulness; human; ai observability; success; ai; offline; review; human review; alerts; end; agent; signals; tool; rate; traces; task; quality; maxim; resolution; measure; links; conventions; semantic conventions; task success; data engine; evaluation
https://getmaxim.ai/articles/llm-observability-best-practices-for-2025/,LLM Observability: Best Practices for 2025,1,ai; observability; llm; llm observability; maxim; evaluation; critical metrics; feedback; request; human; model; user feedback; quality; tracing; llms; maxim ai; challenges; unique; monitoring; model parameters; parameters; user; platforms like; metrics; trace; linking; ai setting; metadata tags; evaluation scores; automated human
https://getmaxim.ai/articles/top-5-llm-observability-platforms-for-2025-comprehensive-comparison-and-guide/,Top 5 LLM Observability Platforms for 2025: Comprehensive Comparison and Guide,1,llm; observability; evaluation; llm observability; comparison; ai; observability platforms; maxim; agent; simulation; integrations; platforms; langchain; enterprise; detailed comparison; key features; detailed; tracing; comparison maxim; features; providers; workflows; tracing prompt; granular; enterprise grade; key; platform; maxim ai; focus; metrics
https://getmaxim.ai/articles/agent-observability-the-definitive-guide-to-monitoring-evaluating-and-perfecting-production-grade-ai-agents/,"Agent Observability: The Definitive Guide to Monitoring, Evaluating, and Perfecting Production-Grade AI Agents",3,agent; maxim; ai; https; getmaxim; getmaxim ai; observability; agent observability; pillar; agents; www; https www; www getmaxim; step; pillars; open standards; ai articles; opentelemetry; traces; evaluators; span; otel; telemetry; automatically; llm; attributes; let; slas; evaluation; autonomous
https://getmaxim.ai/articles/observability-driven-development-building-reliable-ai-agents-with-maxim/,Observability-Driven Development: Building Reliable AI Agents with Maxim,1,docs; maxim; id; trace; observability; const; ai; span; feedback; observability driven; user; metadata; driven development; user feedback; workflows; llm; spans; generations; trace end; evaluation; traces; trace span; logger; generation; distributed; retrieval; metrics; tracing; data; subjective
https://getmaxim.ai/articles/top-5-tools-to-monitor-ai-agents-in-2025/,Top 5 Tools to Monitor AI Agents in 2025,1,ai; agent; monitoring; maxim; agents; ai agents; arize; langfuse; open source; observability; phoenix; arize phoenix; key metrics; prompt; organizations; performance; compliance; self; source; open; end; maxim ai; llm; end agent; monitor key; track latency; robust monitoring; evaluate agent; tracing capture; ideal teams
https://getmaxim.ai/articles/the-state-of-ai-hallucinations-in-2025-challenges-solutions-and-the-maxim-ai-advantage/,"The State of AI Hallucinations in 2025: Challenges, Solutions, and the Maxim AI Advantage",6,ai; hallucinations; ai hallucinations; evaluation; maxim ai; maxim; agent; outputs; prompt; monitoring; prompt management; reliability; agent level; hallucinations ai; management; ambiguity; hallucinations 2025; solutions; observability; 2025; level evaluation; agents; validation; training; monitoring ai; ai solutions; applications; ai systems; trustworthy; risks
https://getmaxim.ai/articles/how-to-build-reliable-ai-agents-the-definitive-guide-for-2025-with-maxim-ai/,How to Build Reliable AI Agents: The Definitive Guide for 2025 with Maxim AI,1,maxim; ai; logger; maxim logger; agent; agents; prompt; evaluation; reliability; maxim ai; observability; building reliable; ai agents; reliable ai; import; maxim vs; response; os; openai; reliable; print; fail; scoring; pass fail; getenv; os getenv; testing; expected; read; regression
https://getmaxim.ai/articles/choosing-the-right-ai-evaluation-and-observability-platform-an-in-depth-comparison-of-maxim-ai-arize-phoenix-langfuse-and-langsmith/,"Choosing the Right AI Evaluation and Observability Platform: An In-Depth Comparison of Maxim AI, Arize Phoenix, Langfuse, and LangSmith",1,ai; evaluation; phoenix; maxim; arize phoenix; langfuse; maxim ai; langsmith; arize; observability; teams; prompt management; feature; prompt; case; pricing; workflows; integrated; observability platform; use case; time production; compliance security; study; case study; open source; management; evaluation prompt; platforms; agent; langchain
https://getmaxim.ai/articles/maxim-ai-vs-arize-phoenix-choosing-the-right-llm-observability-and-evaluation-platform-for-enterprise-ai-teams/,Maxim AI vs Arize Phoenix: Choosing the Right LLM Observability and Evaluation Platform for Enterprise AI Teams,1,phoenix; ai; arize phoenix; evaluation; arize; maxim; maxim ai; observability; phoenix open; open source; capabilities; ai arize; source; open; enterprise; agent; monitoring; prompt management; infrastructure; features; certifications; compliance certifications; teams; applications; management; managed; prompt; integrated; offers comprehensive; llm
https://getmaxim.ai/articles/uncovering-the-real-costs-of-scaling-agentic-ai-how-maxim-ai-empowers-teams-to-build-evaluate-and-deploy-with-confidence/,"Uncovering the Real Costs of Scaling Agentic AI: How Maxim AI Empowers Teams to Build, Evaluate, and Deploy with Confidence",4,agentic; ai; maxim; data quality; maxim ai; evaluation; teams; costs; infrastructure; pricing; complexity; data; promise; hidden; agent; scaling; workflows; observability; unified; inference; evaluations; iteration; platform; overhead; assessments; quality; runtime; ai success; deployment; safety
https://getmaxim.ai/articles/building-reliable-ai-agents-how-to-ensure-quality-responses-every-time/,Building Reliable AI Agents: How to Ensure Quality Responses Every Time,3,ai; https; getmaxim; getmaxim ai; www; https www; maxim; prompt; test; www getmaxim; evaluation; nist; microsoft; feedback; reliability; ai agents; fail; pass fail; test cases; ll; pass; responsible ai; prompts; responsible; tagging; limits; model; agents; nist ai; dashboard
https://getmaxim.ai/articles/top-5-tools-to-detect-hallucinations-in-ai-applications-a-comprehensive-guide/,Top 5 Tools to Detect Hallucinations in AI Applications: A Comprehensive Guide,6,hallucination; ai; detection; maxim; hallucinations; evaluation; maxim vs; hallucinations ai; tools; applications; output; key features; prompt; features; hallucinated; langsmith; langfuse; observability; vs; arize; does; monitoring; comet; evaluation tools; integration; tracking; key; model; prompt management; tracing observability
https://getmaxim.ai/articles/top-10-tools-to-test-your-ai-applications-in-2025/,Top 10 Tools to Test Your AI Applications in 2025,1,ai; maxim; testing; evaluation; key features; agent; maxim ai; agent model; model; monitoring; applications; features; tools; reliability; ai testing; key; maxim vs; ai applications; tracing; models; optimize; model evaluation; comparison maxim; 10 tools; testing ai; systems; ai systems; enterprise; quality; models agents
https://getmaxim.ai/articles/session-level-vs-node-level-metrics-what-each-reveals-about-agent-quality/,Session-Level vs Node-Level Metrics: What Each Reveals About Agent Quality,2,node; level; session; session level; node level; level metrics; tool; metrics; safety; goal; layers; interaction; goal attainment; signals; attainment; behavior; success; guardrail; level safety; triggers; argument; node metrics; adherence; checks; guardrail triggers; evaluation; policies; error; scenario; rates
https://getmaxim.ai/articles/agent-evaluation-vs-model-evaluation-whats-the-difference-and-why-it-matters/,Agent Evaluation vs Model Evaluation: What’s the Difference and Why It Matters,4,evaluation; agent; ai; maxim; agent evaluation; maxim ai; agents; model; ai blog; assessment; defining; model evaluation; scenario; turn interactions; real; human; workflows; world; real world; blog; scenarios; simulation; tool; evaluation scenario; blog ai; environments; interactions; metrics; decision; human reviews
https://getmaxim.ai/articles/top-5-model-evaluation-tools-to-improve-your-llm-powered-applications/,Top 5 Model Evaluation Tools to Improve Your LLM-Powered Applications,4,ml; evaluation; misses; langchain; highlights; comet ml; maxim; best; observability; ai; experiment; llm; fits; teams; comet; want; tools; production; simulation; langsmith; langfuse; llms; arize; evaluation observability; gdpr; best teams; enterprise; arize ai; powered applications; ll
https://getmaxim.ai/articles/agent-frameworks-to-finished-product-your-cheat-code-for-shipping-llm-features-fast/,Agent Frameworks to Finished Product: Your Cheat Code for Shipping LLM Features Fast,5,https; maxim; langchain; www; https www; gumloop; getmaxim; www getmaxim; getmaxim ai; n8n; graph; agent; ai; wins; com; openai agents; agents sdk; sprint; langgraph; openai; import; ai integrations; frameworks; product; auto evals; auto; bifrost; simulation; maxim action; maxim simulation
https://getmaxim.ai/articles/llm-product-development-a-no-nonsense-guide-to-planning-building-and-shipping-at-scale/,"LLM Product Development: A No-Nonsense Guide to Planning, Building, and Shipping at Scale",5,phase; maxim; tuning; auto; fine tuning; block; fine; prompting; generate; roi; evaluation; legal; model; week; feedback loops; text; ai; code; percent; prompts; eval; llm; loops; simulation; auto generate; p90; leave; llm product; product development; model selection
https://getmaxim.ai/articles/top-5-open-source-generative-ai-agent-frameworks-you-need-in-2025/,Top 5 Open-Source Generative AI Agent Frameworks You Need in 2025,3,memory; langchain; crewai; agent; tracer; approval; github; need; langgraph; choose; gives; templates; prototyping; add maxim; handoffs; demos; hooks; stores; handoff; nodes; code; human; add; community; strengths; want; links; maxim; simple; framework
https://getmaxim.ai/articles/prompt-injection-risks-defenses-and-how-to-keep-agents-on-task-2/,"Prompt Injection: Risks, Defenses, and How To Keep Agents On-Task",2,injection; instructions; agent; tool; evaluation; text; injection resilience; injected; prompt injection; policy; retrieved; content; resilience; instruction; defenses; arguments; did; level; adversarial; simulation; retrieval; agents; tool arguments; goal; documents; snippets; release; ai; node level; simulation evaluation
https://getmaxim.ai/articles/the-best-prompt-management-tool-in-2025-why-maxim-ai-leads-the-way/,The Best Prompt Management Tool in 2025: Why Maxim AI Leads the Way,0,prompt; prompt management; management; maxim; prompt versions; optimization; testing; versions; deployment; prompts; prompt playground; bulk testing; ai; testing evaluation; playground; tags; bulk; versioning; prompts scale; teams; scale; metadata; tool; best prompt; sso rbac; 2025; security; workflows; support; publish
https://getmaxim.ai/articles/prompt-engineering-platforms-that-actually-work-2025s-top-picks/,Prompt Engineering Platforms That Actually Work: 2025’s Top Picks,0,prompt; bifrost; ai; evals; region; 2025; maxim; langsmith; spend; langchain; feature; prompts; vendor; free tier; continue; models; agent; cost; eval; observability; prompt engineering; chat; tier; save; token; ui; gateway; platforms; agent simulation; routing
https://getmaxim.ai/articles/what-is-prompt-engineering-a-comprehensive-guide-for-modern-ai-teams/,What Is Prompt Engineering? A Comprehensive Guide for Modern AI Teams,0,prompt engineering; prompt; engineering; ai; experimentation; prompts; engineering prompt; maxim ai; workflows; evaluation; instructions; maxim; models; agent; prompt ide; playgrounds; teams; outputs; ide; context; structured; prompt quality; integration; prompt design; deployment; platforms; enterprise; llms; tools; systematic
https://getmaxim.ai/articles/agent-simulation-a-technical-guide-to-evaluating-ai-agents-in-realistic-conditions/,Agent Simulation: A Technical Guide To Evaluating AI Agents In Realistic Conditions,2,simulation; references; tool; conditions; evaluation; agent; signals; overview; agent simulation; scenario; realistic; release; production; success; personas; including; adherence; workflows; scenarios; human; evaluators; building robust; trajectory quality; references agent; verification; safety adherence; phase; criteria; states; expand
https://getmaxim.ai/articles/agent-simulation-testing-made-simple-with-maxim-ai/,Agent Simulation & Testing Made Simple with Maxim AI,2,simulation; request; trajectory; agent; run; const; flight; maxim; json; return; failed; messages; pii; parse; scripts; response; conversation; client; dataset; agent simulation; turns; persona; data; hallucination; id; assistant; user; workflow; object; max
https://getmaxim.ai/articles/simulate-before-you-ship-5-agent-simulation-scenarios-that-save-money-in-production/,Simulate Before You Ship: 5 Agent-Simulation Scenarios That Save Money in Production,2,simulation; agent; ai; maxim; agents; scenario; evaluation; problem; scenarios; adversarial; maxim ai; testing; agent simulation; value; optimize; coordination; workflows; production; synthetic; compliance; agent behavior; lead; ready agents; testing agents; world; systems; reliability; customer; approach; simulating
https://getmaxim.ai/articles/observability-and-evaluation-in-no-code-agent-builders-unlocking-reliable-ai-with-maxim-ai/,Observability and Evaluation in No-Code Agent Builders: Unlocking Reliable AI with Maxim AI,3,ai; code; maxim; agent; agents; observability evaluation; evaluation; maxim ai; builders; n8n; gumloop; evaluation code; observability; workflows; outputs; teams; did agent; event; metrics; ai agents; flagged; did; human; integrating; alerts; annotation queues; ai delivers; integrating maxim; n8n gumloop; maxim dashboards
https://getmaxim.ai/articles/how-to-build-a-real-time-ai-interview-voice-agent-with-livekit-and-maxim-a-technical-guide/,How to build a Real-Time AI Interview Voice Agent with LiveKit and Maxim: A Technical Guide,1,interview; agent; maxim; room; import; voice; api key; os; ai; getenv; os getenv; await; trace; web; api; search; python; google; job description; credentials; logging; real time; logger; evaluation; job; def; agents; description; real; return
https://getmaxim.ai/articles/prompt-management-in-2025-how-to-organize-test-and-optimize-your-ai-prompts/,"Prompt Management in 2025: How to Organise, Test, and Optimise Your AI Prompts",0,prompt; ai; prompt management; management; ai models; instructions; prompts; teams; safe; maxim ai; like; products; injection; maxim; role; revise; ai outputs; treating; assets; monitor prompt; models; management 2025; helps; outputs; formatting; like code; versioning testing; empower; email; 2025
